Rbr.županije;Županija;Oznaka GROP;Grad/opæina;Rbr BM;Naziv BM;Lokacija BM;Adresa BM;Ukupno biraèa;Glasovalo biraèa;Glasovalo biraèa (po listiæima);Važeæi listiæi;Nevažeæi listiæi;PEJO KOVAÈEVIÆ;IGOR ELMAUER
12;BRODSKO-POSAVSKA ŽUPANIJA;opæina;OPRISAVCI;001;OPRISAVCI;DRUŠTVENI DOM U OPRISAVCIMA;OPRISAVCI, TRG SVETOG KRIŽA 1;389;230;230;223;7;150;73
12;BRODSKO-POSAVSKA ŽUPANIJA;opæina;OPRISAVCI;002;OPRISAVCI;POSLOVNI PROSTOR MATE AKŠAMOVIÆ-OPRISAVCI , SAVSKA ULICA 97;OPRISAVCI, SAVSKA ULICA 97;319;210;210;206;4;157;49
12;BRODSKO-POSAVSKA ŽUPANIJA;opæina;OPRISAVCI;003;TRNJANSKI KUTI;DRUŠTVENI DOM U TRNJANSKIM KUTIMA;TRNJANSKI KUTI 72;263;155;155;153;2;69;84
12;BRODSKO-POSAVSKA ŽUPANIJA;opæina;OPRISAVCI;004;POLJANCI;DRUŠTVENI DOM U POLJANCIMA;POLJANCI 37;216;125;125;124;1;88;36
12;BRODSKO-POSAVSKA ŽUPANIJA;opæina;OPRISAVCI;005;SVILAJ;DRUŠTVENA ZGRADA U SVILAJU;SVILAJ 36;244;128;128;127;1;83;44
12;BRODSKO-POSAVSKA ŽUPANIJA;opæina;OPRISAVCI;006;STRUŽANI;"PROSTORIJE NK ""SLOGA"" STRUŽANI";STRUŽANI 47;120;68;68;67;1;29;38
12;BRODSKO-POSAVSKA ŽUPANIJA;opæina;OPRISAVCI;007;ZOLJANI;DRUŠTVENI DOM U ZOLJANIMA;ZOLJANI 10;20;15;15;15;0;9;6
12;BRODSKO-POSAVSKA ŽUPANIJA;opæina;OPRISAVCI;008;PRNJAVOR;DRUŠTVENI DOM U PRNJAVORU;TRG IVANA OSTOJÈIÆA 1;181;112;112;112;0;74;38
12;BRODSKO-POSAVSKA ŽUPANIJA;opæina;OPRISAVCI;009;NOVI GRAD;"OŠ ""STJEPAN RADIÆ"" PODRUÈNA ŠKOLA U NOVOM GRADU";NOVI GRAD 71;232;151;151;150;1;44;106
