Rbr.županije;Županija;Oznaka GROP;Grad/općina;Rbr BM;Naziv BM;Lokacija BM;Adresa BM;Ukupno birača;Glasovalo birača;Glasovalo birača (po listićima);Važeći listići;Nevažeći listići;FILIP BERNARDIĆ;ANĐELA CIRKVENI;ANĐELKO ŽDRAVAC
01;ZAGREBAČKA ŽUPANIJA;općina;PUŠĆA;001;BIRAČKO MJESTO BROJ 1.;DONJA PUŠĆA;DRUŠTVENI DOM, KUMROVEČKA 107;839;441;441;433;8;204;159;70
01;ZAGREBAČKA ŽUPANIJA;općina;PUŠĆA;002;BIRAČKO MJESTO BROJ 2.;DONJA PUŠĆA;DRUŠTVENI DOM - PROSTORIJA MJESNOG ODBORA, KUMROVEČKA 107/I;460;253;253;243;10;132;72;39
01;ZAGREBAČKA ŽUPANIJA;općina;PUŠĆA;003;BIRAČKO MJESTO BROJ 3.;BREGOVLJANA;KUĆA CIRKVENI ŽELJKE, BREGOVLJANSKA 64;114;47;47;45;2;11;25;9
01;ZAGREBAČKA ŽUPANIJA;općina;PUŠĆA;004;BIRAČKO MJESTO BROJ 4.;HRUŠEVEC PUŠĆANSKI;KUĆA FILKOVIĆ DRAGUTINA, JOSIPA MILIĆA 8;186;94;94;93;1;35;37;21
01;ZAGREBAČKA ŽUPANIJA;općina;PUŠĆA;005;BIRAČKO MJESTO BROJ 5.;HREBINE;KUĆA MAKOVIĆ IVANA, ULICA MATIJE GUPCA 24;279;131;131;129;2;52;43;34
01;ZAGREBAČKA ŽUPANIJA;općina;PUŠĆA;006;BIRAČKO MJESTO BROJ 6.;DUBRAVA PUŠĆANSKA;KUĆA MIHALINEC SLAVICE, DUBROVAČKA CESTA 36;163;67;67;67;0;34;11;22
01;ZAGREBAČKA ŽUPANIJA;općina;PUŠĆA;007;BIRAČKO MJESTO BROJ 7.;MARIJA MAGDALENA;VATROGASNI DOM MARIJA MAGDALENA, DUGANSKA BB;189;137;137;132;5;27;89;16
