Rbr.županije;Županija;Oznaka GROP;Grad/općina;Rbr BM;Naziv BM;Lokacija BM;Adresa BM;Ukupno birača;Glasovalo birača;Glasovalo birača (po listićima);Važeći listići;Nevažeći listići;HRVATSKA DEMOKRATSKA ZAJEDNICA - HDZ;SOCIJALDEMOKRATSKA PARTIJA HRVATSKE - SDP;STJEPAN KOŽIĆ - NEZAVISNA LISTA - SKNL
01;ZAGREBAČKA ŽUPANIJA;općina;PUŠĆA;001;BIRAČKO MJESTO BROJ 1.;DONJA PUŠĆA;DRUŠTVENI DOM, KUMROVEČKA 107;839;441;441;429;12;198;82;149
01;ZAGREBAČKA ŽUPANIJA;općina;PUŠĆA;002;BIRAČKO MJESTO BROJ 2.;DONJA PUŠĆA;DRUŠTVENI DOM - PROSTORIJA MJESNOG ODBORA, KUMROVEČKA 107/I;460;253;253;245;8;126;46;73
01;ZAGREBAČKA ŽUPANIJA;općina;PUŠĆA;003;BIRAČKO MJESTO BROJ 3.;BREGOVLJANA;KUĆA CIRKVENI ŽELJKE, BREGOVLJANSKA 64;114;47;47;46;1;9;13;24
01;ZAGREBAČKA ŽUPANIJA;općina;PUŠĆA;004;BIRAČKO MJESTO BROJ 4.;HRUŠEVEC PUŠĆANSKI;KUĆA FILKOVIĆ DRAGUTINA, JOSIPA MILIĆA 8;186;94;94;93;1;31;27;35
01;ZAGREBAČKA ŽUPANIJA;općina;PUŠĆA;005;BIRAČKO MJESTO BROJ 5.;HREBINE;KUĆA MAKOVIĆ IVANA, ULICA MATIJE GUPCA 24;279;131;131;125;6;51;36;38
01;ZAGREBAČKA ŽUPANIJA;općina;PUŠĆA;006;BIRAČKO MJESTO BROJ 6.;DUBRAVA PUŠĆANSKA;KUĆA MIHALINEC SLAVICE, DUBROVAČKA CESTA 36;163;67;67;67;0;29;28;10
01;ZAGREBAČKA ŽUPANIJA;općina;PUŠĆA;007;BIRAČKO MJESTO BROJ 7.;MARIJA MAGDALENA;VATROGASNI DOM MARIJA MAGDALENA, DUGANSKA BB;189;137;137;134;3;28;18;88
