Rbr.županije;Županija;Oznaka GROP;Grad/opæina;Rbr BM;Naziv BM;Lokacija BM;Adresa BM;Ukupno biraèa;Glasovalo biraèa;Glasovalo biraèa (po listiæima);Važeæi listiæi;Nevažeæi listiæi;HRVATSKA DEMOKRATSKA ZAJEDNICA - HDZ;HRVATSKA SELJAÈKA STRANKA - HSS;MREŽA NEZAVISNIH LISTA - MREŽA;SOCIJALDEMOKRATSKA PARTIJA HRVATSKE - SDP
06;KOPRIVNIÈKO-KRIŽEVAÈKA ŽUPANIJA;opæina;KLOŠTAR PODRAVSKI;001;KLOŠTAR PODRAVSKI;ZGRADA DRUŠTVENOG DOMA KLOŠTAR PODRAVSKI;TRG SVETE OBITELJI 2;892;542;542;517;25;321;66;76;54
06;KOPRIVNIÈKO-KRIŽEVAÈKA ŽUPANIJA;opæina;KLOŠTAR PODRAVSKI;002;ODERJAN;ZGRADA DRUŠTVENOG DOMA ODERJAN;KLOŠTAR PODRAVSKI, ODERJAN 40;243;155;155;147;8;65;36;28;18
06;KOPRIVNIÈKO-KRIŽEVAÈKA ŽUPANIJA;opæina;KLOŠTAR PODRAVSKI;003;BUDANÈEVICA;ZGRADA DRUŠTVENOG DOMA BUDANÈEVICA;STJEPANA RADIÆA 3;370;240;240;234;6;148;33;34;19
06;KOPRIVNIÈKO-KRIŽEVAÈKA ŽUPANIJA;opæina;KLOŠTAR PODRAVSKI;004;PRUGOVAC;ZGRADA DRUŠTVENOG DOMA PRUGOVAC;VINOGRADSKA BB;542;286;286;281;5;185;47;36;13
06;KOPRIVNIÈKO-KRIŽEVAÈKA ŽUPANIJA;opæina;KLOŠTAR PODRAVSKI;005;KOZAREVAC;ZGRADA DRUŠTVENOG DOMA KOZAREVAC;KOZAREVAC, PETRA PRERADOVIÆA 3;407;267;267;260;7;234;16;7;3
