Rbr.županije;Županija;Oznaka GROP;Grad/opæina;Rbr BM;Naziv BM;Lokacija BM;Adresa BM;Ukupno biraèa;Glasovalo biraèa;Glasovalo biraèa (po listiæima);Važeæi listiæi;Nevažeæi listiæi;BERNARD DOMOVIÆ;SINIŠA PAVLOVIÆ
06;KOPRIVNIÈKO-KRIŽEVAÈKA ŽUPANIJA;opæina;KLOŠTAR PODRAVSKI;001;KLOŠTAR PODRAVSKI;ZGRADA DRUŠTVENOG DOMA KLOŠTAR PODRAVSKI;TRG SVETE OBITELJI 2;892;545;545;528;17;172;356
06;KOPRIVNIÈKO-KRIŽEVAÈKA ŽUPANIJA;opæina;KLOŠTAR PODRAVSKI;002;ODERJAN;ZGRADA DRUŠTVENOG DOMA ODERJAN;KLOŠTAR PODRAVSKI, ODERJAN 40;243;155;155;151;4;68;83
06;KOPRIVNIÈKO-KRIŽEVAÈKA ŽUPANIJA;opæina;KLOŠTAR PODRAVSKI;003;BUDANÈEVICA;ZGRADA DRUŠTVENOG DOMA BUDANÈEVICA;STJEPANA RADIÆA 3;370;241;241;236;5;57;179
06;KOPRIVNIÈKO-KRIŽEVAÈKA ŽUPANIJA;opæina;KLOŠTAR PODRAVSKI;004;PRUGOVAC;ZGRADA DRUŠTVENOG DOMA PRUGOVAC;VINOGRADSKA BB;542;287;287;280;7;64;216
06;KOPRIVNIÈKO-KRIŽEVAÈKA ŽUPANIJA;opæina;KLOŠTAR PODRAVSKI;005;KOZAREVAC;ZGRADA DRUŠTVENOG DOMA KOZAREVAC;KOZAREVAC, PETRA PRERADOVIÆA 3;407;267;267;264;3;17;247
