Rbr.županije;Županija;Oznaka GROP;Grad/općina;Rbr BM;Naziv BM;Lokacija BM;Adresa BM;Ukupno birača;Glasovalo birača;Glasovalo birača (po listićima);Važeći listići;Nevažeći listići;SAMOSTALNA DEMOKRATSKA SRPSKA STRANKA - SDSS
15;ŠIBENSKO-KNINSKA ŽUPANIJA;općina;ERVENIK;001;BIRAČKO MJESTO 1;PROSTORIJE MJESNOG ODBORA ERVENIK;ERVENIK;226;111;111;106;5;106
15;ŠIBENSKO-KNINSKA ŽUPANIJA;općina;ERVENIK;002;BIRAČKO MJESTO 2;PROSTORIJE MJESNOG ODBORA MOKRO POLJE;MOKRO POLJE;128;96;96;86;10;86
15;ŠIBENSKO-KNINSKA ŽUPANIJA;općina;ERVENIK;003;BIRAČKO MJESTO 3;PROSTORIJE MJESNOG ODBORA RADUČIĆ;RADUČIĆ;154;133;133;126;7;126
15;ŠIBENSKO-KNINSKA ŽUPANIJA;općina;ERVENIK;004;BIRAČKO MJESTO 4;PROSTORIJE MJESNOG ODBORA PAĐENE;PAĐENE;99;57;57;55;2;55
15;ŠIBENSKO-KNINSKA ŽUPANIJA;općina;ERVENIK;005;BIRAČKO MJESTO 5;PROSTORIJE MJESNOG ODBORA OTON;OTON;83;56;56;56;0;56
