Rbr.županije;Županija;Oznaka GROP;Grad/opæina;Rbr BM;Naziv BM;Lokacija BM;Adresa BM;Ukupno biraèa;Glasovalo biraèa;Glasovalo biraèa (po listiæima);Važeæi listiæi;Nevažeæi listiæi;KANDIDACIJSKA LISTA GRUPE BIRAÈA - ROKO ANTIÆ;KANDIDACIJSKA LISTA GRUPE BIRAÈA -  PAŠKO IVANOVIÆ;SAMOSTALNA DEMOKRATSKA SRPSKA STRANKA - SDSS
15;ŠIBENSKO-KNINSKA ŽUPANIJA;opæina;KISTANJE;001;BIRAÈKO MJESTO 1;PROSTORIJE OPÆINSKE VIJEÆNICE U NOVOJ ZGRADI OPÆINE;KISTANJE;1362;861;860;825;35;333;268;224
15;ŠIBENSKO-KNINSKA ŽUPANIJA;opæina;KISTANJE;002;BIRAÈKO MJESTO 2;PROSTORIJE MJESNOG ODBORA ÐEVRSKE;ÐEVRSKE;292;155;155;149;6;5;8;136
15;ŠIBENSKO-KNINSKA ŽUPANIJA;opæina;KISTANJE;003;BIRAÈKO MJESTO 3;PROSTORIJE MJESNOG ODBORA VARIVODE;VARIVODE;242;110;110;104;6;2;2;100
15;ŠIBENSKO-KNINSKA ŽUPANIJA;opæina;KISTANJE;004;BIRAÈKO MJESTO 4;PROSTORIJE MJESNOG ODBORA IVOŠEVCI;IVOŠEVCI;266;140;140;129;11;6;2;121
15;ŠIBENSKO-KNINSKA ŽUPANIJA;opæina;KISTANJE;005;BIRAÈKO MJESTO 5;PROSTORIJE DOMA KULTURE BIOVIÈINO SELO;BIOVIÈINO SELO;267;134;134;133;1;3;2;128
15;ŠIBENSKO-KNINSKA ŽUPANIJA;opæina;KISTANJE;006;BIRAÈKO MJESTO 6;PROSTORIJE MJESNOG ODBORA NUNIÆ;NUNIÆ;80;45;45;43;2;2;1;40
