Rbr.županije;Županija;Oznaka GROP;Grad/opæina;Rbr BM;Naziv BM;Lokacija BM;Adresa BM;Ukupno biraèa;Glasovalo biraèa;Glasovalo biraèa (po listiæima);Važeæi listiæi;Nevažeæi listiæi;HRVATSKA DEMOKRATSKA ZAJEDNICA - HDZ, HRVATSKA SOCIJALNO - LIBERALNA STRANKA - HSLS;HRVATSKA SELJAÈKA STRANKA - HSS;HRVATSKI SUVERENISTI, HRVATSKA KONZERVATIVNA STRANKA - HKS, HRAST - POKRET ZA USPJEŠNU HRVATSKU, NEOVISNI ZA HRVATSKU - NHR;KANDIDACIJSKA LISTA GRUPE BIRAÈA -  MARKO JELIÆ;MOST, DOMOVINSKI POKRET - DP, LOZA NEZAVISNA LISTA - LOZA;NARODNA STRANKA - REFORMISTI - REFORMISTI, HRVATSKA STRANKA UMIROVLJENIKA - HSU, HRVATSKA NARODNA STRANKA - LIBERALNI DEMOKRATI - HNS;NEZAVISNA LISTA STIPE PETRINA - NLSP;SAMOSTALNA DEMOKRATSKA SRPSKA STRANKA - SDSS;SOCIJALDEMOKRATSKA PARTIJA HRVATSKE - SDP
15;ŠIBENSKO-KNINSKA ŽUPANIJA;grad;DRNIŠ;001;BIRAÈKO MJESTO 1;GLAZBENA  ŠKOLA U DRNIŠU;V. NAZORA 4;548;256;256;241;15;92;5;13;65;26;4;28;4;4
15;ŠIBENSKO-KNINSKA ŽUPANIJA;grad;DRNIŠ;002;BIRAÈKO MJESTO 2;SREDNJA ŠKOLA U DRNIŠU;POLJANA 1;709;350;350;332;18;118;5;9;118;42;7;28;1;4
15;ŠIBENSKO-KNINSKA ŽUPANIJA;grad;DRNIŠ;003;BIRAÈKO MJESTO 3;OSNOVNA ŠKOLA U DRNIŠU;ANTUNA MIHANOVIÆA 4;818;407;406;377;29;155;4;20;102;38;2;40;4;12
15;ŠIBENSKO-KNINSKA ŽUPANIJA;grad;DRNIŠ;004;BIRAÈKO MJESTO 4;SREDNJA ŠKOLA U DRNIŠU;POLJANA 1;481;212;212;200;12;82;0;7;52;35;4;16;1;3
15;ŠIBENSKO-KNINSKA ŽUPANIJA;grad;DRNIŠ;005;BIRAÈKO MJESTO 5;OSNOVNA ŠKOLA U DRINOVCIMA;OKO CRKVE 2;161;64;64;60;4;29;1;8;3;6;7;3;1;2
15;ŠIBENSKO-KNINSKA ŽUPANIJA;grad;DRNIŠ;006;BIRAÈKO MJESTO 6;KUÆA IVICE STOJANOVIÆA (ŠKITE) U KARALIÆU;KOD TRGOVINE 3;226;141;141;137;4;79;3;9;18;22;2;3;0;1
15;ŠIBENSKO-KNINSKA ŽUPANIJA;grad;DRNIŠ;007;BIRAÈKO MJESTO 7;KUÆA DAVORA BAÈIÆA U BRIŠTANIMA;BAÈIÆI 7;147;95;95;88;7;54;1;5;9;11;3;4;0;1
15;ŠIBENSKO-KNINSKA ŽUPANIJA;grad;DRNIŠ;008;BIRAÈKO MJESTO 8;KUÆA ILIJE GALIÆA U BOGATIÆU;KOD ŠKOLE 1;85;57;57;51;6;28;0;2;12;7;0;1;0;1
15;ŠIBENSKO-KNINSKA ŽUPANIJA;grad;DRNIŠ;009;BIRAÈKO MJESTO 9;KUÆA DANICE LJUBIÆ U KLJUÈU;KLJUÈ 23;128;72;72;72;0;60;0;0;6;4;1;1;0;0
15;ŠIBENSKO-KNINSKA ŽUPANIJA;grad;DRNIŠ;010;BIRAÈKO MJESTO 10;OSNOVNA  ŠKOLA U KAOÈINAMA;KOD ŠKOLE KULUŠIÆI 20;201;114;114;105;9;58;1;1;18;18;5;2;0;2
15;ŠIBENSKO-KNINSKA ŽUPANIJA;grad;DRNIŠ;011;BIRAÈKO MJESTO 11;OSNOVNA ŠKOLA U TRBOUNJU;KOD ŠKOLE 4;197;92;92;89;3;29;1;3;18;32;1;4;0;1
15;ŠIBENSKO-KNINSKA ŽUPANIJA;grad;DRNIŠ;012;BIRAÈKO MJESTO 12;KUÆA IVICE TARLE U VELUŠIÆU;TARLE 5;78;46;46;42;4;21;0;0;10;6;1;3;0;1
15;ŠIBENSKO-KNINSKA ŽUPANIJA;grad;DRNIŠ;013;BIRAÈKO MJESTO 13;PROSTORIJA ŽELJEZNIÈKOG KOLODVORA DRNIŠ U BADNJU, BADANJ;ŽELJEZNIÈKA STANICA 6 A;221;92;92;86;6;48;1;5;17;8;1;6;0;0
15;ŠIBENSKO-KNINSKA ŽUPANIJA;grad;DRNIŠ;014;BIRAÈKO MJESTO 14;KUÆA ZVONIMIRA DŽALE U KRIÈKAMA;KOD CRKVE KRALJICE MIRA 20;194;73;73;72;1;34;0;10;11;8;3;4;0;2
15;ŠIBENSKO-KNINSKA ŽUPANIJA;grad;DRNIŠ;015;BIRAÈKO MJESTO 15;OSNOVNA ŠKOLA U SEDRAMIÆU;MILAKOVIÆI 1;159;107;107;102;5;84;2;4;1;9;0;1;0;1
15;ŠIBENSKO-KNINSKA ŽUPANIJA;grad;DRNIŠ;016;BIRAÈKO MJESTO 16;KUÆA MILE MUJANA U ŽITNIÆU;MUJANI 4B, ŽITNIÆ;139;68;68;67;1;28;1;4;13;13;3;2;1;2
15;ŠIBENSKO-KNINSKA ŽUPANIJA;grad;DRNIŠ;017;BIRAÈKO MJESTO 17;OSNOVNA ŠKOLA U PAKOVU SELU;KOD ŠKOLE 10;177;131;131;124;7;100;0;10;7;1;0;5;0;1
15;ŠIBENSKO-KNINSKA ŽUPANIJA;grad;DRNIŠ;018;BIRAÈKO MJESTO 18;OSNOVNA ŠKOLA U POKROVNIKU;LUCIÆI 29;185;93;93;91;2;54;4;12;7;7;1;5;0;1
15;ŠIBENSKO-KNINSKA ŽUPANIJA;grad;DRNIŠ;019;BIRAÈKO MJESTO 19;OSNOVNA ŠKOLA U RADONIÆU;KOD ŠKOLE 1;327;139;139;128;11;64;6;10;16;16;1;14;0;1
15;ŠIBENSKO-KNINSKA ŽUPANIJA;grad;DRNIŠ;020;BIRAÈKO MJESTO 20;OSNOVNA ŠKOLA U SIVERIÆU;OKO ŠKOLE 7;441;227;227;217;10;90;4;11;50;33;4;14;1;10
15;ŠIBENSKO-KNINSKA ŽUPANIJA;grad;DRNIŠ;021;BIRAÈKO MJESTO 21;KUÆA MIROSLAVA ÆOSIÆA U TEPLJUHU;PERIÈIÆI 16;115;39;39;38;1;5;0;2;3;2;2;1;17;6
15;ŠIBENSKO-KNINSKA ŽUPANIJA;grad;DRNIŠ;022;BIRAÈKO MJESTO 22;KUÆA DRAGANA GUNDELJA U BIOÈIÆU;GUNDELJI I DEVIÆI 11;94;33;33;31;2;0;0;0;2;0;1;0;24;4
15;ŠIBENSKO-KNINSKA ŽUPANIJA;grad;DRNIŠ;023;BIRAÈKO MJESTO 23;DOM KULTURE U MIOÈIÆU;PUT PARÈIÆA 1;94;17;17;16;1;3;0;0;8;0;0;2;3;0
15;ŠIBENSKO-KNINSKA ŽUPANIJA;grad;DRNIŠ;024;BIRAÈKO MJESTO 24;KUÆA DRAŽENA BAKOVIÆA  U PARÈIÆU;BANOVCI 4 A;129;60;60;55;5;36;2;1;6;4;1;2;1;2
15;ŠIBENSKO-KNINSKA ŽUPANIJA;grad;DRNIŠ;025;BIRAÈKO MJESTO 25;KUÆA IVICE KRANJCA (GRILE) U KADINOJ GLAVICI;DONJE GORETE 7;159;101;101;97;4;58;8;6;8;10;1;5;1;0
15;ŠIBENSKO-KNINSKA ŽUPANIJA;grad;DRNIŠ;026;BIRAÈKO MJESTO 26;KUÆA BOŽICE VUDRAGOVIÆ U ŠTIKOVU;VUJEVIÆI 8;54;19;19;19;0;7;0;0;2;0;0;0;7;3
15;ŠIBENSKO-KNINSKA ŽUPANIJA;grad;KNIN;001;BIRAÈKO MJESTO 1;"ZGRADA ""HRVATSKIH CESTA"", NADCESTARIJA KNIN";DRNIŠKA CESTA 46, KNIN;120;53;53;50;3;13;0;4;27;0;0;2;3;1
15;ŠIBENSKO-KNINSKA ŽUPANIJA;grad;KNIN;002;BIRAÈKO MJESTO 2;ZGRADA VELEUÈILIŠTA MARKO MARULIÆ;KREŠIMIROVA 30, KNIN;599;305;305;304;1;94;3;12;127;28;1;6;26;7
15;ŠIBENSKO-KNINSKA ŽUPANIJA;grad;KNIN;003;BIRAÈKO MJESTO 3;ZGRADA VELEUÈILIŠTA MARKO MARULIÆ;KREŠIMIROVA 30, KNIN;674;279;279;275;4;96;2;13;121;11;0;6;20;6
15;ŠIBENSKO-KNINSKA ŽUPANIJA;grad;KNIN;004;BIRAÈKO MJESTO 4;"PROSTORIJE ""UPRAVITELJ KNIN"", (BIVŠA TRŽNICA KNIN D.O.O)";VUKOVARSKA 2, KNIN;692;342;342;328;14;112;3;12;138;27;1;7;19;9
15;ŠIBENSKO-KNINSKA ŽUPANIJA;grad;KNIN;005;BIRAÈKO MJESTO 5;"PROSTORIJE ""UPRAVITELJ KNIN"" (BIVŠA TRŽNICA D.O.O.)";VUKOVARSKA 2, KNIN;670;319;319;308;11;125;1;8;125;26;1;7;9;6
15;ŠIBENSKO-KNINSKA ŽUPANIJA;grad;KNIN;006;BIRAÈKO MJESTO 6;ZGRADA OSNOVNE ŠKOLE DOMOVINSKE ZAHVALNOSTI;JOVIÆEVA 2, KNIN;839;401;401;392;9;133;5;17;178;14;1;19;21;4
15;ŠIBENSKO-KNINSKA ŽUPANIJA;grad;KNIN;007;BIRAÈKO MJESTO 7;ZGRADA OSNOVNE ŠKOLE DOMOVINSKE ZAHVALNOSTI;JOVIÆEVA 2, KNIN;780;372;372;359;13;126;2;2;171;18;1;10;21;8
15;ŠIBENSKO-KNINSKA ŽUPANIJA;grad;KNIN;008;BIRAÈKO MJESTO 8;PRIVATNA KUÆA ANDRIJE ŠKEGRO;DOMOVINSKOG RATA 33, KOVAÈIÆ;950;407;407;387;20;116;4;5;177;14;6;8;52;5
15;ŠIBENSKO-KNINSKA ŽUPANIJA;grad;KNIN;009;BIRAÈKO MJESTO 9;"ZGRADA HEP-A ""ELEKTRA""";4. GARDIJSKE 48, KNIN;1336;568;568;553;15;194;4;21;221;38;3;17;44;11
15;ŠIBENSKO-KNINSKA ŽUPANIJA;grad;KNIN;010;BIRAÈKO MJESTO 10;ZGRADA OŠ DR. FRANJE TUÐMANA (BIVŠA II OŠ KNIN);KNEZA IVANIŠA NELIPIÆA 2, KNIN;744;302;302;288;14;96;3;11;118;34;0;6;13;7
15;ŠIBENSKO-KNINSKA ŽUPANIJA;grad;KNIN;011;BIRAÈKO MJESTO 11;ZGRADA OŠ DR.FRANJE TUÐMANA (BIVŠA II OŠ KNIN);KNEZA IVANIŠA NELIPIÆA 2, KNIN;641;284;284;272;12;76;1;9;125;19;1;11;15;15
15;ŠIBENSKO-KNINSKA ŽUPANIJA;grad;KNIN;012;BIRAÈKO MJESTO 12;KUÆA VLATKE ÈOVIÆ;SURONJINA 15, KNIN;1491;638;638;621;17;251;5;21;226;53;3;14;34;14
15;ŠIBENSKO-KNINSKA ŽUPANIJA;grad;KNIN;013;BIRAÈKO MJESTO 13;DOM KULTURE U VRPOLJU;FRA ANDRIJE MARIÆA 2, VRPOLJE;603;266;266;256;10;107;4;11;107;7;0;8;9;3
15;ŠIBENSKO-KNINSKA ŽUPANIJA;grad;KNIN;014;BIRAÈKO MJESTO 14;OSNOVNA ŠKOLA DOMOVINSKE ZAHVALNOSTI, PODRUÈNA ŠKOLA GOLUBIÆ;GOLUBIÆ;724;296;295;279;16;76;4;21;102;14;0;3;53;6
15;ŠIBENSKO-KNINSKA ŽUPANIJA;grad;KNIN;015;BIRAÈKO MJESTO 15;ZGRADA NOVE AMBULANTE;PLAVNO;182;56;56;51;5;6;0;0;15;2;1;0;23;4
15;ŠIBENSKO-KNINSKA ŽUPANIJA;grad;KNIN;016;BIRAÈKO MJESTO 16;KUÆA ÐURE RADOŠA;CENTAR 34, STRMICA;195;82;82;78;4;2;0;0;13;1;0;0;60;2
15;ŠIBENSKO-KNINSKA ŽUPANIJA;grad;KNIN;017;BIRAÈKO MJESTO 17;ZGRADA TELEKOMUNIKACIJA-POŠTA;ZADARSKA 1, ŽAGROVIÆ;531;269;269;260;9;54;7;9;56;14;1;3;105;11
15;ŠIBENSKO-KNINSKA ŽUPANIJA;grad;KNIN;018;BIRAÈKO MJESTO 18;KUÆA ILIJE ORLOVIÆA;LJUBAÈ;51;35;35;34;1;0;0;0;21;1;1;1;9;1
15;ŠIBENSKO-KNINSKA ŽUPANIJA;grad;KNIN;019;BIRAÈKO MJESTO 19;KUÆA VLASNIŠTVA VELJKA TANJGE;OÈESTOVO;90;51;51;48;3;1;0;0;4;0;2;0;40;1
15;ŠIBENSKO-KNINSKA ŽUPANIJA;grad;KNIN;020;BIRAÈKO MJESTO 20;KUÆA RADOJKE MILIVOJEVIÆ;POLAÈA;161;81;81;74;7;0;1;0;22;0;1;1;47;2
15;ŠIBENSKO-KNINSKA ŽUPANIJA;grad;SKRADIN;001;BIRAÈKO MJESTO 1;"""KULTURNI CENTAR U SKRADINU""";ANTUNA BECIÆA 2, SKRADIN;760;255;255;249;6;102;0;26;22;14;5;60;11;9
15;ŠIBENSKO-KNINSKA ŽUPANIJA;grad;SKRADIN;002;BIRAÈKO MJESTO 2;PROSTORIJE OSNOVNE ŠKOLE U DUBRAVICAMA;DUBRAVICE;618;247;247;237;10;129;1;15;14;21;2;36;11;8
15;ŠIBENSKO-KNINSKA ŽUPANIJA;grad;SKRADIN;003;BIRAÈKO MJESTO 3;KUÆA JOSE SLADIÆA POK. GRGE U PLASTOVU;PLASTOVO;259;101;101;91;10;56;2;3;4;3;2;11;7;3
15;ŠIBENSKO-KNINSKA ŽUPANIJA;grad;SKRADIN;004;BIRAÈKO MJESTO 4;PROSTORIJE OSNOVNE ŠKOLE U RUPAMA;RUPE;487;203;203;199;4;139;0;35;6;7;2;6;1;3
15;ŠIBENSKO-KNINSKA ŽUPANIJA;grad;SKRADIN;005;BIRAÈKO MJESTO 5;POSLOVNI PROSTOR DALIBORA DUJIÆA - POSLOVNA ZONA KOSA BB;IÆEVO;116;60;60;60;0;58;0;1;0;0;0;0;1;0
15;ŠIBENSKO-KNINSKA ŽUPANIJA;grad;SKRADIN;006;BIRAÈKO MJESTO 6;POLJOPRIVREDNA ZADRUGA BRANITELJA BRATIŠKOVCI-BRIBIR;DOBROTE VULINOVIÆI 52 A, BRATIŠKOVCI;272;69;69;67;2;7;2;1;2;0;0;7;43;5
15;ŠIBENSKO-KNINSKA ŽUPANIJA;grad;SKRADIN;007;BIRAÈKO MJESTO 7;POSLOVNI PROSTOR ZDRAVKA MARETIÆA U VAÆANIMA;DONJI VAÆANI 15;195;57;57;51;6;23;1;4;3;2;2;4;9;3
15;ŠIBENSKO-KNINSKA ŽUPANIJA;grad;SKRADIN;008;BIRAÈKO MJESTO 8;"PROSTORIJE BOÆARSKOG KLUBA ""SONKOVIÆ"" U SONKOVIÆU";SONKOVIÆ;598;218;218;189;29;73;2;4;4;6;1;19;65;15
15;ŠIBENSKO-KNINSKA ŽUPANIJA;grad;SKRADIN;009;BIRAÈKO MJESTO 9;POSLOVNI PROSTOR JOŠKA CIGIÆA U BRIBIRU (BIVŠA OSNOVNA ŠKOLA);BRIBIRSKE MOSTINE BB;274;67;67;57;10;15;3;2;7;0;1;5;20;4
15;ŠIBENSKO-KNINSKA ŽUPANIJA;grad;SKRADIN;010;BIRAÈKO MJESTO 10;PROSTORIJE OSNOVNE ŠKOLE U PIRAMATOVCIMA;PIRAMATOVCI;244;66;66;61;5;40;1;10;2;4;0;4;0;0
15;ŠIBENSKO-KNINSKA ŽUPANIJA;grad;SKRADIN;011;BIRAÈKO MJESTO 11;PROSTORIJE OSNOVNE ŠKOLE  U KRKOVIÆU;KRKOVIÆ;311;99;99;94;5;46;2;4;9;11;6;10;3;3
15;ŠIBENSKO-KNINSKA ŽUPANIJA;grad;ŠIBENIK;001;BIRAÈKO MJESTO 1;TURISTIÈKO - UGOSTITELJSKA ŠKOLA;ANTE ŠUPUKA BB, ŠIBENIK;725;325;325;315;10;99;8;24;44;8;19;55;1;57
15;ŠIBENSKO-KNINSKA ŽUPANIJA;grad;ŠIBENIK;002;BIRAÈKO MJESTO 2;ZAVOD ZA ZAPOŠLJAVANJE;MATIJE GUPCA 42 A , ŠIBENIK;487;219;219;211;8;45;10;24;24;11;11;47;2;37
15;ŠIBENSKO-KNINSKA ŽUPANIJA;grad;ŠIBENIK;003;BIRAÈKO MJESTO 3;ZAVOD ZA ZAPOŠLJAVANJE;MATIJE GUPCA 42 A, ŠIBENIK;625;281;281;278;3;61;5;20;44;16;14;59;1;58
15;ŠIBENSKO-KNINSKA ŽUPANIJA;grad;ŠIBENIK;004;BIRAÈKO MJESTO 4;OSNOVNA ŠKOLA JURJA ŠIŽGORIÆA;STJEPANA RADIÆA 44 A, ŠIBENIK;987;430;430;419;11;119;11;28;52;22;10;121;0;56
15;ŠIBENSKO-KNINSKA ŽUPANIJA;grad;ŠIBENIK;005;BIRAÈKO MJESTO 5;OSNOVNA ŠKOLA JURJA ŠIŽGORIÆA;STJEPANA RADIÆA 44 A, ŠIBENIK;578;257;257;249;8;84;7;14;34;8;16;49;0;37
15;ŠIBENSKO-KNINSKA ŽUPANIJA;grad;ŠIBENIK;006;BIRAÈKO MJESTO 6;OSNOVNA ŠKOLA JURJA ŠIŽGORIÆA;STJEPANA RADIÆA 44 A, ŠIBENIK;616;221;220;213;7;46;3;16;23;10;17;42;2;54
15;ŠIBENSKO-KNINSKA ŽUPANIJA;grad;ŠIBENIK;007;BIRAÈKO MJESTO 7;OSNOVNA ŠKOLA TINA UJEVIÆA;TRG ANDRIJE HEBRANGA 11,  ŠIBENIK;844;387;387;370;17;109;10;18;48;22;21;77;2;63
15;ŠIBENSKO-KNINSKA ŽUPANIJA;grad;ŠIBENIK;008;BIRAÈKO MJESTO 8;OSNOVNA ŠKOLA TINA UJEVIÆA;TRG ANDRIJE HEBRANGA 11,  ŠIBENIK;705;267;267;260;7;76;5;10;30;14;17;57;3;48
15;ŠIBENSKO-KNINSKA ŽUPANIJA;grad;ŠIBENIK;009;BIRAÈKO MJESTO 9;OSNOVNA ŠKOLA TINA UJEVIÆA;TRG ANDRIJE HEBRANGA 11,  ŠIBENIK;924;376;376;370;6;127;7;23;45;12;20;72;2;62
15;ŠIBENSKO-KNINSKA ŽUPANIJA;grad;ŠIBENIK;010;BIRAÈKO MJESTO 10;OSNOVNA ŠKOLA TINA UJEVIÆA;TRG ANDRIJE HEBRANGA 11, ŠIBENIK;871;367;367;354;13;99;3;25;43;18;19;66;1;80
15;ŠIBENSKO-KNINSKA ŽUPANIJA;grad;ŠIBENIK;011;BIRAÈKO MJESTO 11;OSNOVNA ŠKOLA TINA UJEVIÆA;TRG ANDRIJE HEBRANGA 11, ŠIBENIK;719;309;309;299;10;70;12;17;57;15;26;71;2;29
15;ŠIBENSKO-KNINSKA ŽUPANIJA;grad;ŠIBENIK;012;BIRAÈKO MJESTO 12;OSNOVNA ŠKOLA JURJA DALMATINCA;STIPE NINIÆA 27, ŠIBENIK;542;242;242;226;16;63;11;19;36;7;10;42;3;35
15;ŠIBENSKO-KNINSKA ŽUPANIJA;grad;ŠIBENIK;013;BIRAÈKO MJESTO 13;OSNOVNA ŠKOLA JURJA DALMATINCA;STIPE NINIÆA 27, ŠIBENIK;718;327;327;319;8;112;9;18;47;11;15;64;0;43
15;ŠIBENSKO-KNINSKA ŽUPANIJA;grad;ŠIBENIK;014;BIRAÈKO MJESTO 14;EX UPRAVNA ZGRADA TEF-A - PROSTORIJE CENTRA ZA SOCIJALNU SKRB ŠIBENIK, ODJEL ZA DJECU BRAK I OBITELJ;PRILAZ TVORNICI 39, ŠIBENIK;703;265;265;246;19;90;6;20;25;14;11;45;4;31
15;ŠIBENSKO-KNINSKA ŽUPANIJA;grad;ŠIBENIK;015;BIRAÈKO MJESTO 15;EX UPRAVNA ZGRADA TEF-A - PROSTORIJE CENTRA ZA SOCIJALNU SKRB ŠIBENIK, ODJEL ZA DJECU BRAK I OBITELJ;PRILAZ TVORNICI 39, ŠIBENIK;947;411;411;405;6;185;4;46;50;27;8;72;0;13
15;ŠIBENSKO-KNINSKA ŽUPANIJA;grad;ŠIBENIK;016;BIRAÈKO MJESTO 16;VODOVOD I ODVODNJA D.O.O. ŠIBENIK;KRALJA ZVONIMIRA 50,  ŠIBENIK;904;366;365;351;14;146;10;16;46;25;9;56;0;43
15;ŠIBENSKO-KNINSKA ŽUPANIJA;grad;ŠIBENIK;017;BIRAÈKO MJESTO 17;PROSTORIJE DJEÈJEG VRTIÆA ŽIŽULA;ULICA MILICE I TURKA 4,  ŠIBENIK;490;217;217;213;4;62;7;29;11;24;7;47;1;25
15;ŠIBENSKO-KNINSKA ŽUPANIJA;grad;ŠIBENIK;018;BIRAÈKO MJESTO 18;PROSTORIJE OSNOVNE ŠKOLE METERIZE;PUT KROZ METERIZE 48,  ŠIBENIK;1015;398;398;387;11;146;20;35;30;30;11;75;2;38
15;ŠIBENSKO-KNINSKA ŽUPANIJA;grad;ŠIBENIK;019;BIRAÈKO MJESTO 19;PROSTORIJE OSNOVNE ŠKOLE METERIZE;PUT KROZ METERIZE 48,  ŠIBENIK;1240;520;520;503;17;208;42;46;40;28;11;73;3;52
15;ŠIBENSKO-KNINSKA ŽUPANIJA;grad;ŠIBENIK;020;BIRAÈKO MJESTO 20;PROSTORIJE OSNOVNE ŠKOLE METERIZE;PUT KROZ METERIZE 48,  ŠIBENIK;959;421;421;409;12;132;21;40;45;31;18;50;2;70
15;ŠIBENSKO-KNINSKA ŽUPANIJA;grad;ŠIBENIK;021;BIRAÈKO MJESTO 21;PROSTORIJE GRAD. ÈETVRTI PLIŠAC;FRA STJEPANA ZLATOVIÆA,   ŠIBENIK;637;259;258;252;6;69;4;35;22;12;12;62;0;36
15;ŠIBENSKO-KNINSKA ŽUPANIJA;grad;ŠIBENIK;022;BIRAÈKO MJESTO 22;OSNOVNA ŠKOLA VIDICI - PODRUÈNA ŠKOLA RAŽINE;PUT EGERA BB, ŠIBENIK;1344;534;534;509;25;202;4;53;32;74;19;81;0;44
15;ŠIBENSKO-KNINSKA ŽUPANIJA;grad;ŠIBENIK;023;BIRAÈKO MJESTO 23;PROSTORIJE GRADSKE ÈETVRTI RAŽINE DONJE;LEPENIÈKA 1, ŠIBENIK;699;262;262;248;14;101;2;14;32;29;2;45;1;22
15;ŠIBENSKO-KNINSKA ŽUPANIJA;grad;ŠIBENIK;024;BIRAÈKO MJESTO 24;PROSTORIJE GRADSKE VIJEÆNICE;TRG REPUBLIKE HRVATSKE,  ŠIBENIK;670;264;264;255;9;67;16;29;33;13;6;55;2;34
15;ŠIBENSKO-KNINSKA ŽUPANIJA;grad;ŠIBENIK;025;BIRAÈKO MJESTO 25;PROSTORIJE OSNOVNE ŠKOLE FAUSTA VRANÈIÆA;TRG I.G. KOVAÈIÆA 1,  ŠIBENIK;491;211;211;206;5;46;9;22;28;5;9;51;0;36
15;ŠIBENSKO-KNINSKA ŽUPANIJA;grad;ŠIBENIK;026;BIRAÈKO MJESTO 26;PROSTORIJE OSNOVNE ŠKOLE FAUSTA VRANÈIÆA;TRG I.G. KOVAÈIÆA 1, ŠIBENIK;461;200;199;191;8;54;4;32;16;17;7;41;0;20
15;ŠIBENSKO-KNINSKA ŽUPANIJA;grad;ŠIBENIK;027;BIRAÈKO MJESTO 27;PROSTORIJE O.Š. P. KREŠIMIRA IV;BANA J. JELAÈIÆA 74,  ŠIBENIK;820;363;358;349;9;109;7;28;59;20;14;58;1;53
15;ŠIBENSKO-KNINSKA ŽUPANIJA;grad;ŠIBENIK;028;BIRAÈKO MJESTO 28;PROSTORIJE O.Š. P. KREŠIMIRA IV;BANA J. JELAÈIÆA 74,  ŠIBENIK;782;331;331;326;5;86;11;25;40;15;21;67;4;57
15;ŠIBENSKO-KNINSKA ŽUPANIJA;grad;ŠIBENIK;029;BIRAÈKO MJESTO 29;PROSTORIJE O.Š. P. KREŠIMIRA IV;BANA J. JELAÈIÆA 74,  ŠIBENIK;663;278;278;271;7;70;4;26;35;16;16;55;2;47
15;ŠIBENSKO-KNINSKA ŽUPANIJA;grad;ŠIBENIK;030;BIRAÈKO MJESTO 30;PROSTORIJE O.Š. P. KREŠIMIRA IV;BANA J. JELAÈIÆA 74,  ŠIBENIK;1138;504;504;488;16;157;7;33;54;35;14;123;2;63
15;ŠIBENSKO-KNINSKA ŽUPANIJA;grad;ŠIBENIK;031;BIRAÈKO MJESTO 31;PROSTORIJE PROMETNO TEHNIÈKE ŠKOLE (EX EKONOMSKA ŠKOLA);KRALJA ZVONIMIRA 2,  ŠIBENIK;699;282;282;271;11;91;7;17;40;12;11;39;1;53
15;ŠIBENSKO-KNINSKA ŽUPANIJA;grad;ŠIBENIK;032;BIRAÈKO MJESTO 32;KREŠIMIROV DOM;TRG PALIH BRANITELJA DOMOVINSKOG RATA 1,  ŠIBENIK;769;312;312;301;11;111;2;32;24;18;20;48;4;42
15;ŠIBENSKO-KNINSKA ŽUPANIJA;grad;ŠIBENIK;033;BIRAÈKO MJESTO 33;OSNOVNA ŠKOLA VIDICI;8. DALMATINSKE UDARNE BRIGADE BB, ŠIBENIK;514;191;191;187;4;56;4;4;17;17;8;42;0;39
15;ŠIBENSKO-KNINSKA ŽUPANIJA;grad;ŠIBENIK;034;BIRAÈKO MJESTO 34;OSNOVNA ŠKOLA VIDICI;8. DALMATINSKE UDARNE BRIGADE BB, ŠIBENIK;551;209;209;199;10;50;5;18;27;11;9;50;1;28
15;ŠIBENSKO-KNINSKA ŽUPANIJA;grad;ŠIBENIK;035;BIRAÈKO MJESTO 35;OSNOVNA ŠKOLA VIDICI;8. DALMATINSKE UDARNE BRIGADE BB, ŠIBENIK;593;253;253;250;3;74;9;25;29;17;7;41;1;47
15;ŠIBENSKO-KNINSKA ŽUPANIJA;grad;ŠIBENIK;036;BIRAÈKO MJESTO 36;OSNOVNA ŠKOLA VIDICI;8. DALMATINSKE UDARNE BRIGADE BB, ŠIBENIK;669;272;272;264;8;54;3;16;34;29;11;58;3;56
15;ŠIBENSKO-KNINSKA ŽUPANIJA;grad;ŠIBENIK;037;BIRAÈKO MJESTO 37;OSNOVNA ŠKOLA VIDICI;8. DALMATINSKE UDARNE BRIGADE BB, ŠIBENIK;671;292;292;282;10;109;2;12;27;20;11;66;4;31
15;ŠIBENSKO-KNINSKA ŽUPANIJA;grad;ŠIBENIK;038;BIRAÈKO MJESTO 38;PROSTORIJE ŠPORTSKOG KLUBA POLET U ZABLAÆU;ZABLAÆE;661;192;192;187;5;75;1;16;14;3;9;41;0;28
15;ŠIBENSKO-KNINSKA ŽUPANIJA;grad;ŠIBENIK;039;BIRAÈKO MJESTO 39;PROSTORIJE TURISTIÈKOG UREDA JADRIJA;JADRIJA;224;105;105;102;3;25;3;6;7;12;2;23;3;21
15;ŠIBENSKO-KNINSKA ŽUPANIJA;grad;ŠIBENIK;040;BIRAÈKO MJESTO 40;ŠKOLSKA ZGRADA U BORAJI;BORAJA BB;214;110;110;103;7;71;1;9;2;8;0;9;0;3
15;ŠIBENSKO-KNINSKA ŽUPANIJA;grad;ŠIBENIK;041;BIRAÈKO MJESTO 41;PROSTORIJE MJESNOG ODBORA BRODARICA;KRAPANJSKIH SPUŽVARA 4, BRODARICA;736;269;268;260;8;82;1;16;27;18;7;77;0;32
15;ŠIBENSKO-KNINSKA ŽUPANIJA;grad;ŠIBENIK;042;BIRAÈKO MJESTO 42;OSNOVNA ŠKOLA BRODARICA;GOMLJANIK 100, BRODARICA;847;295;295;289;6;106;6;23;31;10;9;74;1;29
15;ŠIBENSKO-KNINSKA ŽUPANIJA;grad;ŠIBENIK;043;BIRAÈKO MJESTO 43;OSNOVNA ŠKOLA BRODARICA;GOMLJANIK 100, BRODARICA;973;344;344;327;17;117;4;22;26;27;8;86;0;37
15;ŠIBENSKO-KNINSKA ŽUPANIJA;grad;ŠIBENIK;044;BIRAÈKO MJESTO 44;ŠKOLSKA ZGRADA U DANILU;DANILO BB;315;135;135;128;7;71;1;9;9;9;5;13;0;11
15;ŠIBENSKO-KNINSKA ŽUPANIJA;grad;ŠIBENIK;045;BIRAÈKO MJESTO 45;PROSTORIJE ŠKOLSKE ZGRADE U DANILU BIRNJU;DANILO BIRANJ BB;376;152;152;150;2;65;7;23;10;15;7;15;0;8
15;ŠIBENSKO-KNINSKA ŽUPANIJA;grad;ŠIBENIK;046;BIRAÈKO MJESTO 46;PROSTORIJE ŠKOLSKE ZGRADE U DANILU KRALJICAMA;DANILO KRALJICE BB;106;48;48;46;2;38;0;3;2;1;0;2;0;0
15;ŠIBENSKO-KNINSKA ŽUPANIJA;grad;ŠIBENIK;047;BIRAÈKO MJESTO 47;PRIVATNA KUÆA VLASNIŠTVO ZVONKA MIŠURE U DONJEM POLJU;VRPOLJAÈKA CESTA 8, DONJE POLJE;236;82;82;77;5;34;3;2;7;7;2;13;0;9
15;ŠIBENSKO-KNINSKA ŽUPANIJA;grad;ŠIBENIK;048;BIRAÈKO MJESTO 48;PODRUÈNA OSNOVNA ŠKOLA PETRA KREŠIMIRA IV U DUBRAVI KOD ŠIBENIKA;DUBRAVA KOD ŠIBENIKA BB;706;325;325;317;8;122;2;45;39;19;5;60;0;25
15;ŠIBENSKO-KNINSKA ŽUPANIJA;grad;ŠIBENIK;049;BIRAÈKO MJESTO 49;U PRIVATNOJ KUÆI VLASNIŠTVO IVICE RAKA;RAKOVO SELO 67;293;143;143;139;4;51;3;14;16;10;4;26;1;14
15;ŠIBENSKO-KNINSKA ŽUPANIJA;grad;ŠIBENIK;050;BIRAÈKO MJESTO 50;MJESNI ODBOR GORIŠ;LABORI 63A, GORIŠ;126;73;73;73;0;43;0;1;5;10;1;7;0;6
15;ŠIBENSKO-KNINSKA ŽUPANIJA;grad;ŠIBENIK;051;BIRAÈKO MJESTO 51;U PROSTORIJAMA ŠKOLSKE ZGRADE U  GREBAŠTICI;GREBAŠTICA DONJA BB;907;389;388;371;17;158;3;21;34;32;10;92;2;19
15;ŠIBENSKO-KNINSKA ŽUPANIJA;grad;ŠIBENIK;052;BIRAÈKO MJESTO 52;PROSTORIJE MJESNOG ODBORA JADRTOVAC U JADRTOVCU;JADRTOVAC BB;156;68;68;66;2;28;3;2;5;5;0;14;0;9
15;ŠIBENSKO-KNINSKA ŽUPANIJA;grad;ŠIBENIK;053;BIRAÈKO MJESTO 53;PROSTORIJE MJESNOG ODBORA KAPRIJE U KAPRIJU;KAPRIJE BB;271;121;121;111;10;44;5;8;11;5;1;15;0;22
15;ŠIBENSKO-KNINSKA ŽUPANIJA;grad;ŠIBENIK;054;BIRAÈKO MJESTO 54;PROSTORIJE LOVAÈKOG DOMA KRKA U KONJEVRATIMA;KONJEVRATE, KONJEVRATE BB;297;109;109;107;2;52;1;10;6;3;2;16;1;16
15;ŠIBENSKO-KNINSKA ŽUPANIJA;grad;ŠIBENIK;055;BIRAÈKO MJESTO 55;PROSTORIJE ŠKOLSKE ZGRADE U BRNJICI;BRNJICA BB;70;30;30;30;0;15;0;1;1;5;2;2;0;4
15;ŠIBENSKO-KNINSKA ŽUPANIJA;grad;ŠIBENIK;056;BIRAÈKO MJESTO 56;PROSTORIJE ŠKOLSKE ZGRADE U KRAPNJU;KRAPANJ BB;260;75;75;74;1;29;2;7;2;3;8;14;0;9
15;ŠIBENSKO-KNINSKA ŽUPANIJA;grad;ŠIBENIK;057;BIRAÈKO MJESTO 57;U PRIVATNOJ KUÆI VINKA PAŠKALINA (POK. NIKOLE) U LEPENICI;MRDEŽE 5;58;31;31;31;0;24;0;3;0;2;0;2;0;0
15;ŠIBENSKO-KNINSKA ŽUPANIJA;grad;ŠIBENIK;058;BIRAÈKO MJESTO 58;PROSTORIJE MJESNOG ODBORA LOZOVAC U TROMILJI;TROMILJA BB;351;127;127;122;5;48;2;6;11;6;5;26;2;16
15;ŠIBENSKO-KNINSKA ŽUPANIJA;grad;ŠIBENIK;059;BIRAÈKO MJESTO 59;PROSTORIJE PODRUÈNE ŠKOLE JURJA DALMATINCA U TROMILJI;TROMILJA BB;250;81;81;80;1;28;2;11;5;7;4;9;2;12
15;ŠIBENSKO-KNINSKA ŽUPANIJA;grad;ŠIBENIK;060;BIRAÈKO MJESTO 60;OSNOVNA ŠKOLA VRPOLJE, PODRUÈNA ŠKOLA PERKOVIÆ;SITNO DONJE  BB;523;254;254;243;11;138;2;20;16;43;0;16;2;6
15;ŠIBENSKO-KNINSKA ŽUPANIJA;grad;ŠIBENIK;061;BIRAÈKO MJESTO 61;MJESNA PROSTORIJA U MRAVNICI;MRAVNICA BB;57;34;34;32;2;28;0;1;0;2;0;1;0;0
15;ŠIBENSKO-KNINSKA ŽUPANIJA;grad;ŠIBENIK;062;BIRAÈKO MJESTO 62;MJESNA PROSTORIJA U SLIVNU  (ERCEZI);SLIVNO - ERCEZI BB;99;39;39;37;2;19;0;5;1;5;0;3;1;3
15;ŠIBENSKO-KNINSKA ŽUPANIJA;grad;ŠIBENIK;063;BIRAÈKO MJESTO 63;PROSTORIJE MJESNOG ODBORA PODINE;PODINE BB;27;9;9;9;0;7;0;0;0;0;0;1;0;1
15;ŠIBENSKO-KNINSKA ŽUPANIJA;grad;ŠIBENIK;064;BIRAÈKO MJESTO 64;PROSTORIJE ŠKOLSKE ZGRADE U RASLINI;RASLINA BB;541;249;249;240;9;105;5;16;15;20;7;26;1;45
15;ŠIBENSKO-KNINSKA ŽUPANIJA;grad;ŠIBENIK;065;BIRAÈKO MJESTO 65;PROSTORIJE OSNOVNE ŠKOLE U VRPOLJU;VRPOLJE BB;680;314;314;306;8;142;4;42;26;22;4;47;0;19
15;ŠIBENSKO-KNINSKA ŽUPANIJA;grad;ŠIBENIK;066;BIRAÈKO MJESTO 66;PROSTORIJE MJESNOG ODBORA VRSNO U VRSNOM;VRSNO BB;77;39;39;37;2;27;0;7;0;0;1;2;0;0
15;ŠIBENSKO-KNINSKA ŽUPANIJA;grad;ŠIBENIK;067;BIRAÈKO MJESTO 67;U PROSTORIJAMA VATROGASNOG DOMA U ZATONU;ZATONSKI ŽRTAVA 74 A;927;338;338;332;6;113;4;24;44;36;8;57;0;46
15;ŠIBENSKO-KNINSKA ŽUPANIJA;grad;ŠIBENIK;068;BIRAÈKO MJESTO 68;U PROSTORIJAMA DOMA KULTURE U ZLARINU;ISPOD LEROJA BB;332;152;152;148;4;51;6;7;9;4;13;25;1;32
15;ŠIBENSKO-KNINSKA ŽUPANIJA;grad;ŠIBENIK;069;BIRAÈKO MJESTO 69;PROSTORIJE MJESNOG ODBORA ŽABORIÆ U ŽABORIÆU;TUTIKOVA 1;612;258;258;251;7;106;5;16;14;16;7;52;0;35
15;ŠIBENSKO-KNINSKA ŽUPANIJA;grad;ŠIBENIK;070;BIRAÈKO MJESTO 70;PROSTORIJE MJESNOG ODBORA ŽIRJE U ŽIRJU;TRG BB;228;101;101;100;1;27;14;2;9;8;1;20;1;18
15;ŠIBENSKO-KNINSKA ŽUPANIJA;grad;VODICE;001;BIRAÈKO MJESTO 1;ZGRADA KULTURNOG CENTRA U VODICAMA;IVE ÈAÆE 8;1119;611;611;597;14;178;18;27;72;78;4;159;2;59
15;ŠIBENSKO-KNINSKA ŽUPANIJA;grad;VODICE;002;BIRAÈKO MJESTO 2;"ZGRADA OSNOVNE ŠKOLE ""VODICE"" (UÈIONICA BR. I. - PRIZEMLJE)";MIÆIN STANKA BB;1238;578;578;557;21;185;4;26;62;72;7;154;3;44
15;ŠIBENSKO-KNINSKA ŽUPANIJA;grad;VODICE;003;BIRAÈKO MJESTO 3;"ZGRADA OSNOVNE ŠKOLE ""VODICE"" (UÈIONICA BR. II. - PRIZEMLJE)";MIÆIN STANKA BB;1142;580;580;570;10;204;23;29;56;80;6;127;0;45
15;ŠIBENSKO-KNINSKA ŽUPANIJA;grad;VODICE;004;BIRAÈKO MJESTO 4;"ZGRADA OSNOVNE ŠKOLE ""VODICE"" (UÈIONICA BR. III. - PRIZEMLJE)";MIÆIN STANKA BB;1227;470;469;449;20;150;6;22;57;63;4;108;2;37
15;ŠIBENSKO-KNINSKA ŽUPANIJA;grad;VODICE;005;BIRAÈKO MJESTO 5;"ZGRADA OSNOVNE ŠKOLE ""VODICE"" (UÈIONICA BR. IV. - PRIZEMLJE)";MIÆIN STANKA BB;1257;461;461;443;18;183;9;21;38;70;4;92;1;25
15;ŠIBENSKO-KNINSKA ŽUPANIJA;grad;VODICE;006;BIRAÈKO MJESTO 6;"ZGRADA OSNOVNE ŠKOLE ""VODICE"" (UÈIONICA BR. V. - PRIZEMLJE)";MIÆIN STANKA BB;1327;493;493;480;13;154;11;16;54;101;1;98;1;44
15;ŠIBENSKO-KNINSKA ŽUPANIJA;grad;VODICE;007;BIRAÈKO MJESTO 7;PROSTORIJE MJESNOG ODBORA SRIMA;SRIMA;993;387;387;378;9;106;6;18;42;47;6;112;3;38
15;ŠIBENSKO-KNINSKA ŽUPANIJA;grad;VODICE;008;BIRAÈKO MJESTO 8;PROSTOR MJESNOG ODBORA PRVIÆ LUKA (EX DVA BUNARA);PRVIÆ LUKA;202;104;104;102;2;21;1;4;8;8;3;20;0;37
15;ŠIBENSKO-KNINSKA ŽUPANIJA;grad;VODICE;009;BIRAÈKO MJESTO 9;PROSTOR MJESNOG ODBORA PRVIÆ ŠEPURINE;PRVIÆ ŠEPURINE;289;158;158;155;3;47;6;7;15;11;4;39;0;26
15;ŠIBENSKO-KNINSKA ŽUPANIJA;grad;VODICE;010;BIRAÈKO MJESTO 10;OSNOVNA ŠKOLA ÈISTA VELIKA;ÈISTA VELIKA;427;257;257;249;8;146;2;12;35;25;1;16;0;12
15;ŠIBENSKO-KNINSKA ŽUPANIJA;grad;VODICE;011;BIRAÈKO MJESTO 11;EX AMBULANTA U ÈISTOJ MALOJ;ÈISTA MALA;179;65;65;64;1;17;1;0;2;0;3;9;24;8
15;ŠIBENSKO-KNINSKA ŽUPANIJA;grad;VODICE;012;BIRAÈKO MJESTO 12;OSNOVNA ŠKOLA GAÆELEZI;GAÆELEZI;219;97;97;95;2;65;4;2;4;14;0;6;0;0
15;ŠIBENSKO-KNINSKA ŽUPANIJA;grad;VODICE;013;BIRAÈKO MJESTO 13;KUÆA VLASNIKA STIPANA BRUSANA;GRABOVCI 18;80;58;58;57;1;42;1;0;1;7;3;3;0;0
15;ŠIBENSKO-KNINSKA ŽUPANIJA;opæina;BILICE;001;BIRAÈKO MJESTO 1;U ŠKOLSKOJ ZGRADI U BILICAMA;BILICE;1251;558;558;530;28;188;12;34;61;63;6;119;2;45
15;ŠIBENSKO-KNINSKA ŽUPANIJA;opæina;BILICE;002;BIRAÈKO MJESTO 2;U ŠKOLSKOJ ZGRADI U BILICAMA;BILICE;1020;406;406;381;25;165;5;17;19;49;7;86;1;32
15;ŠIBENSKO-KNINSKA ŽUPANIJA;opæina;BISKUPIJA;001;BIRAÈKO MJESTO 1;ZGRADA OPÆINE BISKUPIJA;TRG IVANA MEŠTROVIÆA 2, ORLIÆ;190;99;99;97;2;2;0;1;9;1;0;0;76;8
15;ŠIBENSKO-KNINSKA ŽUPANIJA;opæina;BISKUPIJA;002;BIRAÈKO MJESTO 2;PROSTORIJE MJESNOG ODBORA BISKUPIJA;PUT SVETE TROJICE 6, BISKUPIJA;285;143;143;134;9;22;3;1;20;4;2;0;72;10
15;ŠIBENSKO-KNINSKA ŽUPANIJA;opæina;BISKUPIJA;003;BIRAÈKO MJESTO 3;PROSTORIJE MJESNOG ODBORA MARKOVAC;CENTAR 84, RIÐANE;81;43;43;39;4;1;1;1;0;0;0;0;33;3
15;ŠIBENSKO-KNINSKA ŽUPANIJA;opæina;BISKUPIJA;004;BIRAÈKO MJESTO 4;ZGRADA DOMA KULTURE U VRBNIKU;VUKADINI 2, VRBNIK;304;159;159;151;8;6;1;1;20;5;1;3;111;3
15;ŠIBENSKO-KNINSKA ŽUPANIJA;opæina;BISKUPIJA;005;BIRAÈKO MJESTO 5;PROSTORIJE MJESNOG ODBORA ZVJERINAC;KOD ŽELJEZNIÈKE POSTAJE 16, ZVJERINAC;245;115;115;101;14;11;0;1;16;0;0;1;54;18
15;ŠIBENSKO-KNINSKA ŽUPANIJA;opæina;BISKUPIJA;006;BIRAÈKO MJESTO 6;PROSTORIJE NOVE O.Š. U RAMLJANIMA;BAÈCI 9, RAMLJANE;114;73;73;71;2;3;1;0;10;0;0;0;55;2
15;ŠIBENSKO-KNINSKA ŽUPANIJA;opæina;CIVLJANE;001;BIRAÈKO MJESTO 1;OPÆINA CIVLJANE;KOD DOMA 3, CIVLJANE;62;38;38;34;4;3;0;1;8;1;0;0;16;5
15;ŠIBENSKO-KNINSKA ŽUPANIJA;opæina;CIVLJANE;002;BIRAÈKO MJESTO 2;ZGRADA BIVŠE OSNOVNE ŠKOLE;MILAŠI 47, CETINA;114;67;67;56;11;6;0;2;20;2;0;2;15;9
15;ŠIBENSKO-KNINSKA ŽUPANIJA;opæina;CIVLJANE;003;BIRAÈKO MJESTO 3;OBITELJSKA KUÆA VELJKA KNEŽEVIÆA;KNEŽEVIÆI 34, CETINA;49;35;35;33;2;13;1;1;4;3;0;1;7;3
15;ŠIBENSKO-KNINSKA ŽUPANIJA;opæina;ERVENIK;001;BIRAÈKO MJESTO 1;PROSTORIJE MJESNOG ODBORA ERVENIK;ERVENIK;226;113;113;113;0;9;2;1;4;0;0;0;95;2
