Rbr.županije;Županija;Oznaka GROP;Grad/općina;Rbr BM;Naziv BM;Lokacija BM;Adresa BM;Ukupno birača;Glasovalo birača;Glasovalo birača (po listićima);Važeći listići;Nevažeći listići;HRVATSKA DEMOKRATSKA ZAJEDNICA - HDZ, HRVATSKA STRANKA PRAVA - HSP, HRVATSKA SELJAČKA STRANKA - HSS, HRVATSKA STRANKA PRAVA DR. ANTE STARČEVIĆ U STEČAJU - HSP AS;HRVATSKA NARODNA STRANKA - LIBERALNI DEMOKRATI - HNS, SOCIJALDEMOKRATSKA PARTIJA HRVATSKE - SDP, AKCIJA MLADIH - AM, STRANKA UMIROVLJENIKA - SU;MOST
13;ZADARSKA ŽUPANIJA;općina;PAKOŠTANE;001;PAKOŠTANE;MALA VIJEĆNICA (ZAPADNO KRILO) ZGRADE OPĆINE PAKOŠTANE;KRALJICE JELENE 78, PAKOŠTANE;1131;551;550;520;30;342;59;119
13;ZADARSKA ŽUPANIJA;općina;PAKOŠTANE;002;PAKOŠTANE;VELIKA VIJEĆNICA (ISTOČNO KRILO) ZGRADE OPĆINE PAKOŠTANE;KRALJICE JELENE 78, PAKOŠTANE;963;462;462;432;30;243;72;117
13;ZADARSKA ŽUPANIJA;općina;PAKOŠTANE;003;VRANA;OSNOVNA ŠKOLA U VRANI;VRANA;683;267;267;246;21;200;11;35
13;ZADARSKA ŽUPANIJA;općina;PAKOŠTANE;004;DRAGE;OSNOVNA ŠKOLA U DRAGAMA;DRAGE;923;482;482;460;22;279;94;87
13;ZADARSKA ŽUPANIJA;općina;PAKOŠTANE;005;VRGADA;OSNOVNA ŠKOLA U VRGADI;VRGADA;238;117;117;108;9;39;52;17
