Rbr.županije;Županija;Oznaka GROP;Grad/općina;Rbr BM;Naziv BM;Lokacija BM;Adresa BM;Ukupno birača;Glasovalo birača;Glasovalo birača (po listićima);Važeći listići;Nevažeći listići;PERO GROŠETA;NIKOLA KNEŽIĆ;VLAHO MOZARA
19;DUBROVAČKO-NERETVANSKA ŽUPANIJA;općina;DUBROVAČKO PRIMORJE;001;MAJKOVI;ZGRADA VATROGASNOG DOMA BIRAČKO MJESTO I;MAJKOVI BB;160;96;96;94;2;13;46;35
19;DUBROVAČKO-NERETVANSKA ŽUPANIJA;općina;DUBROVAČKO PRIMORJE;002;SLANO;ZGRADA DJEČJEG VRTIĆA BIRAČKO MJESTO II;SLANO BB;546;343;343;339;4;29;152;158
19;DUBROVAČKO-NERETVANSKA ŽUPANIJA;općina;DUBROVAČKO PRIMORJE;003;BANIĆI;EX ŠKOLA BANIĆI BIRAČKO MJESTO III;BANIĆI BB;209;124;124;121;3;13;64;44
19;DUBROVAČKO-NERETVANSKA ŽUPANIJA;općina;DUBROVAČKO PRIMORJE;004;LISAC;ZGRADA ŠKOLE BIRAČKO MJESTO IV.;LISAC BB;140;73;73;72;1;10;35;27
19;DUBROVAČKO-NERETVANSKA ŽUPANIJA;općina;DUBROVAČKO PRIMORJE;005;DOLI;DOM ZADUŽBINE MIHANOVIĆ U DOLIMA BIRAČKO MJESTO V.;DOLI BB;172;85;85;85;0;17;29;39
19;DUBROVAČKO-NERETVANSKA ŽUPANIJA;općina;DUBROVAČKO PRIMORJE;006;VISOČANI;SEOSKI DOM U VISOČANIMA BIRAČKO MJESTO VI.;VISOČANI BB;149;103;103;99;4;5;76;18
19;DUBROVAČKO-NERETVANSKA ŽUPANIJA;općina;DUBROVAČKO PRIMORJE;007;OŠLJE;ZGRADA ŠKOLE  BIRAČKO MJESTO VII.;OŠLJE BB;116;72;72;71;1;12;41;18
19;DUBROVAČKO-NERETVANSKA ŽUPANIJA;općina;DUBROVAČKO PRIMORJE;008;TOPOLO;ZGRADA ŠKOLE BIRAČKO MJESTO VIII.;TOPOLO BB;175;99;99;97;2;29;50;18
