Rbr.županije;Županija;Oznaka GROP;Grad/opæina;Rbr BM;Naziv BM;Lokacija BM;Adresa BM;Ukupno biraèa;Glasovalo biraèa;Glasovalo biraèa (po listiæima);Važeæi listiæi;Nevažeæi listiæi;HRVATSKA DEMOKRATSKA ZAJEDNICA - HDZ
12;BRODSKO-POSAVSKA ŽUPANIJA;opæina;DONJI ANDRIJEVCI;001;STARO TOPOLJE;"OŠ ""V.C.EMIN"", PODRUÈNA ŠKOLA STARO TOPOLJE";STARO TOPOLJE, IVE LOLE RIBARA 71;591;145;145;106;39;106
12;BRODSKO-POSAVSKA ŽUPANIJA;opæina;DONJI ANDRIJEVCI;002;NOVO TOPOLJE;DRUŠTVENI DOM  NOVO TOPOLJE;NOVO TOPOLJE 21;137;34;34;32;2;32
12;BRODSKO-POSAVSKA ŽUPANIJA;opæina;DONJI ANDRIJEVCI;003;DONJI ANDRIJEVCI;"OSNOVNA ŠKOLA ""V.C. EMIN"" DONJI ANDRIJEVCI";DONJI ANDRIJEVCI, TRG KRALJA TOMISLAVA 8;572;151;151;113;38;113
12;BRODSKO-POSAVSKA ŽUPANIJA;opæina;DONJI ANDRIJEVCI;004;DONJI ANDRIJEVCI;"OSNOVNA ŠKOLA ""V.C. EMIN"" DONJI ANDRIJEVCI";DONJI ANDRIJEVCI, TRG KRALJA TOMISLAVA 8;737;216;216;155;61;155
12;BRODSKO-POSAVSKA ŽUPANIJA;opæina;DONJI ANDRIJEVCI;005;SREDANCI;DRUŠTVENI DOM U SREDANCIMA;SREDANCI 24;254;111;111;90;21;90
12;BRODSKO-POSAVSKA ŽUPANIJA;opæina;DONJI ANDRIJEVCI;006;DONJI ANDRIJEVCI;"OSNOVAN ŠKOLA ""V.C. EMIN"" DONJI ANDRIJEVCI";DONJI ANDRIJEVCI, TRG KRALJA TOMISLAVA 8;752;227;227;183;44;183
