Rbr.županije;Županija;Oznaka GROP;Grad/općina;Rbr BM;Naziv BM;Lokacija BM;Adresa BM;Ukupno birača;Glasovalo birača;Glasovalo birača (po listićima);Važeći listići;Nevažeći listići;MATO GRGIĆ;TOMISLAV VIDAKOVIĆ;KREŠIMIR VOJTKUF
12;BRODSKO-POSAVSKA ŽUPANIJA;općina;GARČIN;001;GARČIN;OSNOVNA ŠKOLA U GARČINU;GARČIN;246;132;132;127;5;71;30;26
12;BRODSKO-POSAVSKA ŽUPANIJA;općina;GARČIN;002;GARČIN;OSNOVNA ŠKOLA U GARČINU;GARČIN;480;218;218;211;7;134;36;41
12;BRODSKO-POSAVSKA ŽUPANIJA;općina;GARČIN;003;SELNA;DRUŠTVENI DOM U SELNI;SELNA;249;128;128;124;4;72;31;21
12;BRODSKO-POSAVSKA ŽUPANIJA;općina;GARČIN;004;BICKO SELO;OSNOVNA ŠKOLA U BICKOM SELU;BICKO SELO;411;259;259;250;9;135;46;69
12;BRODSKO-POSAVSKA ŽUPANIJA;općina;GARČIN;005;SAPCI;OSNOVNA ŠKOLA U SAPCIMA;SAPCI;397;218;218;207;11;133;33;41
12;BRODSKO-POSAVSKA ŽUPANIJA;općina;GARČIN;006;VRHOVINA;DRUŠTVENI DOM U VRHOVINI;VRHOVINA;192;125;125;123;2;82;39;2
12;BRODSKO-POSAVSKA ŽUPANIJA;općina;GARČIN;007;KLOKOČEVIK;DRUŠTVENI DOM U KLOKOČEVIKU;KLOKOČEVIK;433;212;212;198;14;124;65;9
12;BRODSKO-POSAVSKA ŽUPANIJA;općina;GARČIN;008;TRNJANI;OSNOVNA ŠKOLA U TRNJANIMA;TRNJANI;732;222;222;216;6;156;26;34
12;BRODSKO-POSAVSKA ŽUPANIJA;općina;GARČIN;009;ZADUBRAVLJE;OSNOVNA ŠKOLA U ZADUBRAVLJU;ZADUBRAVLJE;715;387;387;376;11;147;202;27
