Rbr.županije;Županija;Oznaka GROP;Grad/opæina;Rbr BM;Naziv BM;Lokacija BM;Adresa BM;Ukupno biraèa;Glasovalo biraèa;Glasovalo biraèa (po listiæima);Važeæi listiæi;Nevažeæi listiæi;HRVATSKA DEMOKRATSKA ZAJEDNICA - HDZ;HRVATSKA SOCIJALNO - LIBERALNA STRANKA - HSLS;MATIJA POSAVEC - NEZAVISNA LISTA - MATIJA POSAVEC - NL, NARODNA STRANKA - REFORMISTI - REFORMISTI, HRVATSKA DEMOKRATSKA SELJAÈKA STRANKA - HDSS, DEMOKRATI, CENTAR;SOCIJALDEMOKRATSKA PARTIJA HRVATSKE - SDP, HRVATSKA STRANKA UMIROVLJENIKA - HSU;KANDIDACIJSKA LISTA GRUPE BIRAÈA -  MILJENKO VRANÈIÆ
20;MEÐIMURSKA ŽUPANIJA;opæina;SELNICA;001;SELNICA;DRUŠTVENI DOM U SELNICI;TRG SVETOG MARKA 2;949;417;417;412;5;211;30;128;29;14
20;MEÐIMURSKA ŽUPANIJA;opæina;SELNICA;002;DONJI KONCOVÈAK;DRUŠTVENI DOM U DONJEM KONCOVÈAKU;DONJI KONCOVÈAK 39A;264;114;114;111;3;54;1;36;20;0
20;MEÐIMURSKA ŽUPANIJA;opæina;SELNICA;003;ZEBANEC SELO;PODRUÈNA ŠKOLA ZEBANEC SELO;ZEBANEC SELO 66;796;310;310;306;4;99;15;78;69;45
20;MEÐIMURSKA ŽUPANIJA;opæina;SELNICA;004;MERHATOVEC;DRUŠTVENI DOM U MERHATOVCU;MERHATOVEC 22A;121;61;61;60;1;34;0;18;6;2
20;MEÐIMURSKA ŽUPANIJA;opæina;SELNICA;005;PRAPORÈAN;DRUŠTVENI DOM U PRAPORÈANU;ULICA ZRINSKIH 26A;135;72;72;69;3;54;3;8;3;1
20;MEÐIMURSKA ŽUPANIJA;opæina;SELNICA;006;BUKOVEC;OBITELJSKA KUÆA ZORANA SRŠANA;BUKOVEC 71A;165;65;65;61;4;44;0;15;2;0
20;MEÐIMURSKA ŽUPANIJA;opæina;SELNICA;007;ZAVEŠÈAK;DRUŠTVENI DOM U ZAVEŠÈAKU;GORNJI ZEBANEC 48;202;80;80;74;6;47;0;17;9;1
