Rbr.županije;Županija;Oznaka GROP;Grad/opæina;Rbr BM;Naziv BM;Lokacija BM;Adresa BM;Ukupno biraèa;Glasovalo biraèa;Glasovalo biraèa (po listiæima);Važeæi listiæi;Nevažeæi listiæi;KRUNOSLAV ÐUREC;TIHOMIR RADIÈEK
06;KOPRIVNIÈKO-KRIŽEVAÈKA ŽUPANIJA;opæina;KALNIK;001;KALNIK;DOM  HRVATSKIH BRANITELJA;TRG STJEPANA RADIÆA 5;273;174;174;172;2;138;34
06;KOPRIVNIÈKO-KRIŽEVAÈKA ŽUPANIJA;opæina;KALNIK;002;KAMEŠNICA;PROSTORIJE DVD-A KAMEŠNICA;ÐURCI 2;128;88;88;87;1;60;27
06;KOPRIVNIÈKO-KRIŽEVAÈKA ŽUPANIJA;opæina;KALNIK;003;POTOK KALNIÈKI;PROSTORIJE DRUŠTVENOG DOMA POTOK KALNIÈKI;POTOK KALNIÈKI 38;134;96;96;87;9;57;30
06;KOPRIVNIÈKO-KRIŽEVAÈKA ŽUPANIJA;opæina;KALNIK;004;BORJE;PROSTORIJE DRUŠTVENOG DOMA DONJE BORJE;DONJE BORJE 19;146;95;95;95;0;69;26
06;KOPRIVNIÈKO-KRIŽEVAÈKA ŽUPANIJA;opæina;KALNIK;005;ŠOPRON;PROSTORIJE DRUŠTVENOG DOMA ŠOPRON;ŠOPRON 57;146;98;98;95;3;67;28
06;KOPRIVNIÈKO-KRIŽEVAÈKA ŽUPANIJA;opæina;KALNIK;006;POPOVEC KALNIÈKI;PROSTORIJE DRUŠTVENOG DOMA POPOVEC KALNIÈKI;POPOVEC KALNIÈKI 5;136;89;89;88;1;52;36
06;KOPRIVNIÈKO-KRIŽEVAÈKA ŽUPANIJA;opæina;KALNIK;007;VOJNOVEC KALNIÈKI;PROSTORIJE (NOVOG) DRUŠTVENOG DOMA VOJNOVEC KALNIÈKI;VOJNOVEC KALNIÈKI 70;94;58;58;54;4;37;17
