Rbr.županije;Županija;Oznaka GROP;Grad/općina;Rbr BM;Naziv BM;Lokacija BM;Adresa BM;Ukupno birača;Glasovalo birača;Glasovalo birača (po listićima);Važeći listići;Nevažeći listići;IVICA KOPIĆ;LUCIJA MATKOVIĆ
03;SISAČKO-MOSLAVAČKA ŽUPANIJA;općina;DONJI KUKURUZARI;001;DONJA VELEŠNJA;PROSTOR ISPRED STARE ŠKOLE;DONJA VELEŠNJA;258;141;141;129;12;46;83
03;SISAČKO-MOSLAVAČKA ŽUPANIJA;općina;DONJI KUKURUZARI;002;DONJI KUKURUZARI;ZGRADA OPĆINE (DVORANA ZA UDRUGE);ULICA DON ANTE LIZATOVIĆA 2;417;196;196;181;15;53;128
03;SISAČKO-MOSLAVAČKA ŽUPANIJA;općina;DONJI KUKURUZARI;003;MEČENČANI;OSNOVNA ŠKOLA KATARINA ZRINSKA;MEČENČANI BB;203;107;107;95;12;12;83
03;SISAČKO-MOSLAVAČKA ŽUPANIJA;općina;DONJI KUKURUZARI;004;BOROJEVIĆI;DRUŠTVENI DOM BOROJEVIĆI;BOROJEVIĆI 30 B;192;102;102;84;18;22;62
03;SISAČKO-MOSLAVAČKA ŽUPANIJA;općina;DONJI KUKURUZARI;005;UMETIĆ;PRIVATAN OBJEKT JOVANA PRERADOVIĆA;UMETIĆ 15;173;98;98;85;13;10;75
