Rbr.županije;Županija;Oznaka GROP;Grad/opæina;Rbr BM;Naziv BM;Lokacija BM;Adresa BM;Ukupno biraèa;Glasovalo biraèa;Glasovalo biraèa (po listiæima);Važeæi listiæi;Nevažeæi listiæi;DEMOKRATSKI SAVEZ SRBA - DSS;KANDIDACIJSKA LISTA GRUPE BIRAÈA -  IVAN HODAK;HRVATSKA DEMOKRATSKA ZAJEDNICA - HDZ, HRVATSKA STRANKA UMIROVLJENIKA - HSU;SAMOSTALNA DEMOKRATSKA SRPSKA STRANKA - SDSS;SOCIJALDEMOKRATSKA PARTIJA HRVATSKE - SDP
14;OSJEÈKO-BARANJSKA ŽUPANIJA;opæina;DARDA;001;DARDA;DOM KULTURE;SVETOG IVANA KRSTITELJA 100;712;255;255;244;11;16;31;138;33;26
14;OSJEÈKO-BARANJSKA ŽUPANIJA;opæina;DARDA;002;DARDA;DOM KULTURE;SVETOG IVANA KRSTITELJA 100;711;251;251;233;18;11;39;139;24;20
14;OSJEÈKO-BARANJSKA ŽUPANIJA;opæina;DARDA;003;DARDA;SREDNJA ŠKOLA BELI MANASTIR, PODRUÈNI ODJEL DARDA;SVETOG IVANA KRSTITELJA 109;606;238;238;235;3;10;56;107;43;19
14;OSJEÈKO-BARANJSKA ŽUPANIJA;opæina;DARDA;004;DARDA;SREDNJA ŠKOLA BELI MANASTIR, PODRUÈNI ODJEL DARDA;SVETOG IVANA KRSTITELJA 109;603;238;238;225;13;17;34;99;36;39
14;OSJEÈKO-BARANJSKA ŽUPANIJA;opæina;DARDA;005;DARDA;OSNOVNA ŠKOLA DARDA, UÈIONICA BROJ 12;ŠKOLSKA 9;871;295;295;279;16;6;70;156;26;21
14;OSJEÈKO-BARANJSKA ŽUPANIJA;opæina;DARDA;006;DARDA;OSNOVNA ŠKOLA DARDA, UÈIONICA BROJ 3;ŠKOLSKA 9;741;295;295;275;20;13;31;199;25;7
14;OSJEÈKO-BARANJSKA ŽUPANIJA;opæina;DARDA;007;MECE;DOM MEÐUGENERACIJSKE SOLIDARNOSTI I KLUB MLADIH;BELJSKA 48;725;269;269;256;13;4;87;114;18;33
14;OSJEÈKO-BARANJSKA ŽUPANIJA;opæina;DARDA;008;UGLJEŠ;OSNOVNA ŠKOLA DARDA, PODRUÈNI ODJEL UGLJEŠ;BARANJSKA ULICA 11;400;231;230;217;13;99;4;21;84;9
